{
  "requirements": {
    "V1-01": "PASS",
    "V1-02": "PASS",
    "V1-03": "PASS",
    "V1-04": "PASS",
    "V1-05": "PASS",
    "V1-06": "PASS",
    "V1-07": "PASS",
    "V1-08": "PASS",
    "V1-09": "PASS",
    "V1-10": "PASS",
    "V1-11": "PASS",
    "V1-12": "PASS",
    "V1-13": "PASS",
    "V1-14": "PASS",
    "V1-15": "PASS",
    "V1-16": "PASS",
    "V1-17": "PASS",
    "V1-18": "PASS",
    "V1-19": "PASS",
    "V1-20": "PASS",
    "V1-21": "PASS",
    "V1-22": "PASS",
    "V1-23": "PASS",
    "V1-24": "PASS",
    "V1-25": "PASS",
    "V1-26": "PASS",
    "V1-27": "PASS",
    "V1-28": "PASS",
    "V1-29": "PASS",
    "V1-30": "PASS"
  },
  "gate_result": "PASS",
  "professional_human_review": "COMPLETE",
  "real_pilot_status": "PASSED",
  "codex_certified": true,
  "claude_certified": true,
  "human_release_approval": true,
  "approved_by": "Publisher Owner"
}
