{
  "requirements": {
    "V1-01": "PENDING",
    "V1-02": "PENDING",
    "V1-03": "PENDING",
    "V1-04": "PENDING",
    "V1-05": "PENDING",
    "V1-06": "PENDING",
    "V1-07": "PENDING",
    "V1-08": "PENDING",
    "V1-09": "PENDING",
    "V1-10": "PENDING",
    "V1-11": "PENDING",
    "V1-12": "PENDING",
    "V1-13": "PENDING",
    "V1-14": "PENDING",
    "V1-15": "PENDING",
    "V1-16": "PENDING",
    "V1-17": "PENDING",
    "V1-18": "PENDING",
    "V1-19": "PENDING",
    "V1-20": "PENDING",
    "V1-21": "PENDING",
    "V1-22": "PENDING",
    "V1-23": "PENDING",
    "V1-24": "PENDING",
    "V1-25": "PENDING",
    "V1-26": "PENDING",
    "V1-27": "PENDING",
    "V1-28": "PENDING",
    "V1-29": "PENDING",
    "V1-30": "PENDING"
  },
  "gate_result": "PENDING",
  "professional_human_review": "PENDING",
  "real_pilot_status": "PENDING",
  "codex_certified": false,
  "claude_certified": false,
  "human_release_approval": false,
  "approved_by": null
}
